<!ELEMENT family (member)*>
<!ATTLIST element-name attribute-name ID #REQUIRED>

<!ELEMENT member (name,age,gender)*>
<!ELEMENT name (#PCDATA)>
<!ELEMENT age (#PCDATA)>
<!ELEMENT gender (#PCDATA)>